<?xml version="1.0" encoding="UTF-8"?>
<!--
To change this license header, choose License Headers in Project Properties.
To change this template file, choose Tools | Templates
and open the template in the editor.
-->

<!DOCTYPE timetable SYSTEM "timetable.dtd">
<timetable>
    <days>
        <day weekday="mon">
            <timeslot start-time="0830" end-time="0920">
                <course program="ACIT" code="4950">
                    <booking instructor="Jim">
                        Sauna
                    </booking>
                </course>
            </timeslot>
        </day>
    </days>
    <timeslots>TIME</timeslots>
    <courses>COURSES</courses>
</timetable>
